{
  "captionTracks": [
    { "track": 1, "style": { "color": "#ffdd55", "fontSizePx": 30 } }
  ],
  "overlays": [
    {
      "start": 6.7,
      "end": 8.3,
      "file": "materials/still.png",
      "rect": { "x": 600, "y": 50, "w": 300, "h": 169 },
      "opacity": 0.7
    },
    {
      "start": 20.5,
      "end": 21.5,
      "file": "materials/still.png",
      "rect": { "x": 50, "y": 50, "w": 300, "h": 169 },
      "opacity": 1
    }
  ],
  "inserts": [
    {
      "at": 8.5,
      "file": "materials/clip.mp4",
      "durationSec": 1.2
    }
  ],
  "wipeFull": [
    { "start": 12.85, "end": 13.9 }
  ],
  "zooms": [
    { "start": 14.0, "end": 14.5, "rect": { "x": 0,   "y": 0,   "w": 480, "h": 270 } },
    { "start": 14.5, "end": 14.9, "rect": { "x": 480, "y": 270, "w": 480, "h": 270 } }
  ],
  "blurs": [
    { "start": 16.5, "end": 17.5, "rect": { "x": 100, "y": 380, "w": 300, "h": 100 }, "strength": 0.6 }
  ],
  "annotations": [
    { "type": "arrow", "start": 18.5, "end": 19.5, "from": { "x": 200, "y": 200 }, "to": { "x": 500, "y": 350 } },
    { "type": "box", "start": 18.5, "end": 19.5, "rect": { "x": 600, "y": 100, "w": 250, "h": 150 } }
  ],
  "colorFilter": { "saturate": 1.8 }
}
